{"family":"Technical Editing","skill_id":"TE","run_id":"TE-RUN-EXAMPLE","specification_version":"0.1.0","rule_version":"0.1.0","status":"pass","owner":"TE owner","coverage_statement":{"checked":["headings","objects","crossrefs"],"unavailable":[],"excluded":["substantive truth"],"formats":["docx"],"does_not_establish":["source validity"]},"evidence_ids":["TE-E1"],"finding_ids":[],"release_effect":"none","generated_at":"2026-08-14T00:00:00Z","stale_against":null}
